{"run":26,"commit":"pending","metric":0,"metrics":{"e2e_unpassed_tests":1,"e2e_failures":1,"missing_required_flows":0,"e2e_exit_code":1,"screenshots_found":33,"videos_found":1},"status":"discard","description":"Tried strengthening evidence flow with timeline heading, empty count, Documents tab, external-link, selected link, and final item-count assertions, but the suite failed.","timestamp":1778821101661,"segment":3,"confidence":null,"asi":{"hypothesis":"Evidence timeline quality improves by asserting the initial empty state, document picker controls, selected link, and final timeline count rather than only broad post-add text.","rollback_reason":"Full suite no longer passed, so evidence_assertions were zeroed and the patch was discarded.","next_action_hint":"Inspect failure output; likely the initial '0 items' text is not stable because prior test data leaves existing evidence, or the final '1 item' assertion should be count-increase rather than absolute."}}
{"run":27,"commit":"9273905","metric":4,"metrics":{"e2e_unpassed_tests":0,"e2e_failures":0,"missing_required_flows":0,"e2e_exit_code":0,"screenshots_found":33,"videos_found":1},"status":"keep","description":"Added stable evidence timeline assertions for the timeline heading and empty item count using strict-safe locators; full E2E suite still passes.","timestamp":1778821231241,"segment":3,"confidence":null,"asi":{"hypothesis":"The previous stronger evidence assertion batch only failed due duplicate text strictness; adding strict-safe assertions for visible timeline heading and initial zero-item state should improve evidence coverage without brittleness.","outcome":"Evidence assertions increased from 2 to 4 while all 13 E2E tests passed.","next_action_hint":"Next promising step: add one strict-safe assertion for the Documents tab/control or selected external link, avoiding absolute final item counts unless comparing against initial count."}}
{"run":28,"commit":"9273905","metric":6,"metrics":{"e2e_unpassed_tests":0,"e2e_failures":0,"missing_required_flows":0,"e2e_exit_code":0,"screenshots_found":33,"videos_found":1},"status":"keep","description":"Added strict-safe evidence picker assertions for the Documents tab and external-link input while preserving the passing suite.","timestamp":1778821370821,"segment":3,"confidence":2,"asi":{"hypothesis":"After heading/empty-state coverage, the next stable evidence assertions are the Documents tab visibility and the external-link field visibility before filling it.","outcome":"Evidence assertions increased from 4 to 6 while all 13 E2E tests passed.","next_action_hint":"Next promising assertion: after pressing the small Add button for the external link, assert the selected link appears before submitting the evidence mutation; avoid absolute final item counts unless deriving the previous count."}}
{"run":29,"commit":"9273905","metric":8,"metrics":{"e2e_unpassed_tests":0,"e2e_failures":0,"missing_required_flows":0,"e2e_exit_code":0,"screenshots_found":33,"videos_found":1},"status":"keep","description":"Asserted the selected external evidence link appears after pressing Add, and asserted the Link 1 item submit button before linking evidence.","timestamp":1778821518856,"segment":3,"confidence":3,"asi":{"hypothesis":"The safest next evidence-strengthening step is to assert the picker state transition: URL input becomes a selected evidence link, and the mutation submit button reflects exactly one selected item before submission.","outcome":"Evidence assertions increased from 6 to 8 while all 13 E2E tests passed.","next_action_hint":"Next promising assertion: after linking, assert the timeline item count/content using a strict-safe visible text assertion that does not assume global prior evidence outside the newly created bumicert."}}
{"run":30,"commit":"9273905","metric":10,"metrics":{"e2e_unpassed_tests":0,"e2e_failures":0,"missing_required_flows":0,"e2e_exit_code":0,"screenshots_found":33,"videos_found":1},"status":"keep","description":"Added post-link evidence timeline assertions for the updated one-item count and visible linked-file CTA.","timestamp":1778821686130,"segment":3,"confidence":4,"asi":{"hypothesis":"After linking evidence to a newly created bumicert, the timeline should update from the initial empty state to one item and expose the linked-file CTA, strengthening end-state verification without assuming global prior data.","outcome":"Evidence assertions increased from 8 to 10 while all 13 E2E tests passed.","next_action_hint":"Next promising assertion: verify the final timeline entry classification or ownership controls, such as a visible Documents label or Remove evidence button, while avoiding assertions that depend on external indexer enrichment timing."}}
{"run":31,"commit":"9273905","metric":12,"metrics":{"e2e_unpassed_tests":0,"e2e_failures":0,"missing_required_flows":0,"e2e_exit_code":0,"screenshots_found":33,"videos_found":1},"status":"keep","description":"Added final timeline assertions for the document filter count and owner remove-evidence control.","timestamp":1778826476683,"segment":3,"confidence":3.3333333333333335,"asi":{"hypothesis":"After linking one document-style external URL, the timeline should classify the entry under the Document filter with a count of one and expose the owner-only remove control, strengthening final state coverage without depending on external enrichment timing.","outcome":"Evidence assertions increased from 10 to 12 while all 13 E2E tests passed.","next_action_hint":"Next promising assertion: verify the Evidence Timeline filter interaction by clicking the Document filter and confirming the linked file remains visible, then optionally clicking a non-matching filter to assert an empty filtered state if stable."}}
{"run":32,"commit":"9273905","metric":15,"metrics":{"e2e_unpassed_tests":0,"e2e_failures":0,"missing_required_flows":0,"e2e_exit_code":0,"screenshots_found":33,"videos_found":1},"status":"keep","description":"Added evidence timeline filter interaction assertions for matching Document and non-matching Tree filters.","timestamp":1778826596442,"segment":3,"confidence":3.25,"asi":{"hypothesis":"The timeline filter controls can be verified generically after adding one document evidence item: selecting Document should mark that filter active and keep the linked file visible, while selecting Tree should show the empty filtered state.","outcome":"Evidence assertions increased from 12 to 15 while all 13 E2E tests passed.","next_action_hint":"Next promising assertion: verify the Remove evidence control opens a confirmation UI without deleting, then cancel it and assert the linked file remains visible."}}
{"run":33,"commit":"9273905","metric":19,"metrics":{"e2e_unpassed_tests":0,"e2e_failures":0,"missing_required_flows":0,"e2e_exit_code":0,"screenshots_found":33,"videos_found":1},"status":"keep","description":"Added remove-evidence confirmation assertions and cancel-flow verification without deleting the linked evidence.","timestamp":1778826732331,"segment":3,"confidence":4.25,"asi":{"hypothesis":"The owner remove-evidence control should open a confirmation UI that can be canceled safely; asserting that flow strengthens evidence timeline coverage without mutating away the newly linked evidence.","outcome":"Evidence assertions increased from 15 to 19 while all 13 E2E tests passed.","next_action_hint":"Next promising assertion: verify accessible expanded/collapsed state on the evidence row, or assert the linked-file href matches the submitted URL if Playwright can read it stably."}}
{"run":34,"commit":"9273905","metric":24,"metrics":{"e2e_unpassed_tests":0,"e2e_failures":0,"missing_required_flows":0,"e2e_exit_code":0,"screenshots_found":33,"videos_found":1},"status":"keep","description":"Added linked-file href and timeline entry expand/collapse accessibility assertions.","timestamp":1778826857185,"segment":3,"confidence":4.4,"asi":{"hypothesis":"The final evidence row should preserve the submitted external URL and expose accessible collapse/expand state; asserting these checks strengthens the timeline interaction coverage without depending on external services.","outcome":"Evidence assertions increased from 19 to 24 while all 13 E2E tests passed.","next_action_hint":"Next promising assertion: verify the optional note text added during evidence linking is rendered in the expanded timeline entry, if the editor stores plain filled text reliably."}}
{"run":35,"commit":"pending","metric":0,"metrics":{"e2e_unpassed_tests":1,"e2e_failures":1,"missing_required_flows":0,"e2e_exit_code":1,"screenshots_found":33,"videos_found":1},"status":"discard","description":"Tried adding All-filter assertions after evidence expand/collapse, but the suite failed before reaching the new assertions.","timestamp":1778827003919,"segment":3,"confidence":4.4,"asi":{"hypothesis":"After validating document and tree filters, clicking the All filter should mark it active and keep the linked evidence visible, strengthening timeline filter coverage.","outcome":"The run failed before the new All-filter assertions at the initial post-navigation Add Evidence visibility wait, so this iteration did not validate the hypothesis.","rollback_reason":"Full E2E suite did not pass and primary evidence_assertions was zeroed by the harness.","next_action_hint":"Inspect the failure screenshot/trace for the early Add Evidence wait; if it is an environment/navigation flake, rerun a no-change stability check or add a more robust wait for the evidence tab route before reattempting All-filter assertions."}}
{"run":36,"commit":"9273905","metric":26,"metrics":{"e2e_unpassed_tests":0,"e2e_failures":0,"missing_required_flows":0,"e2e_exit_code":0,"screenshots_found":33,"videos_found":1},"status":"keep","description":"Added All-filter assertions after restoring the expanded evidence entry; rerun confirmed the prior early failure was not caused by these assertions.","timestamp":1778827120312,"segment":3,"confidence":4,"asi":{"hypothesis":"After validating matching and non-matching filters, selecting the All filter should mark it active and keep the linked evidence visible, strengthening generic timeline filter coverage.","outcome":"Evidence assertions increased from 24 to 26 while all 13 E2E tests passed; the previous early Add Evidence wait failure did not reproduce.","next_action_hint":"Next promising assertion: verify the visible timeline entry label/title, such as the Document entry heading or linked-date metadata, using strict-safe locators that do not depend on the exact current date."}}
{"run":37,"commit":"9273905","metric":29,"metrics":{"e2e_unpassed_tests":0,"e2e_failures":0,"missing_required_flows":0,"e2e_exit_code":0,"screenshots_found":33,"videos_found":1},"status":"keep","description":"Added scoped final timeline entry assertions for the rendered evidence row, document label, and linked metadata.","timestamp":1778827242982,"segment":3,"confidence":3.857142857142857,"asi":{"hypothesis":"After linking and filtering evidence, the final timeline row should be discoverable as an article containing the linked file, document classification, and linked-date metadata; scoped assertions avoid relying on global duplicate text or exact dates.","outcome":"Evidence assertions increased from 26 to 29 while all 13 E2E tests passed.","next_action_hint":"Next promising assertion: verify the evidence optional note appears in the expanded timeline entry, if a focused fill into the Leaflet editor is stable; otherwise add assertions around the picker selected-link remove control before submission."}}
{"run":38,"commit":"9273905","metric":33,"metrics":{"e2e_unpassed_tests":0,"e2e_failures":0,"missing_required_flows":0,"e2e_exit_code":0,"screenshots_found":33,"videos_found":1},"status":"keep","description":"Added selected-link removal and re-addition assertions in the evidence picker before submitting evidence.","timestamp":1778827371623,"segment":3,"confidence":3.6470588235294117,"asi":{"hypothesis":"The evidence picker should let a user remove a selected external link, return the submit button to its empty-selection state, and then re-add the same link before submitting; this strengthens pre-mutation picker behavior without changing product flows.","outcome":"Evidence assertions increased from 29 to 33 while all 13 E2E tests passed.","next_action_hint":"Next promising assertion: verify the optional note text appears in the expanded timeline entry, or add scoped assertions for the selected link row label such as External link before removal if note rendering is uncertain."}}
{"run":39,"commit":"9273905","metric":35,"metrics":{"e2e_unpassed_tests":0,"e2e_failures":0,"missing_required_flows":0,"e2e_exit_code":0,"screenshots_found":33,"videos_found":1},"status":"keep","description":"Added external-link validation assertions before adding a valid evidence URL.","timestamp":1778827494380,"segment":3,"confidence":3.6666666666666665,"asi":{"hypothesis":"The evidence picker should reject malformed external URLs, show the validation message, and keep submission disabled until valid evidence is selected; asserting this strengthens pre-submit validation coverage without changing product behavior.","outcome":"Evidence assertions increased from 33 to 35 while all 13 E2E tests passed.","next_action_hint":"Next promising assertion: add a scoped selected-link row assertion for the External link label before removal/re-addition, or investigate whether optional note rendering is stable enough to assert after linking."}}
{"run":40,"commit":"9273905","metric":37,"metrics":{"e2e_unpassed_tests":0,"e2e_failures":0,"missing_required_flows":0,"e2e_exit_code":0,"screenshots_found":33,"videos_found":1},"status":"keep","description":"Added scoped selected-link row assertions for the external-link evidence picker state.","timestamp":1778827622585,"segment":3,"confidence":3.5,"asi":{"hypothesis":"After re-adding the valid external URL, the picker should render a selected-link row that contains both the External link label and the exact URL; scoped row assertions strengthen picker-state coverage without relying only on global text presence.","outcome":"Evidence assertions increased from 35 to 37 while all 13 E2E tests passed.","next_action_hint":"Next promising assertion: verify optional note text appears in the expanded timeline entry if Leaflet rendering is stable, or assert the content type selector default remains Document before submission."}}
{"run":41,"commit":"9273905","metric":39,"metrics":{"e2e_unpassed_tests":0,"e2e_failures":0,"missing_required_flows":0,"e2e_exit_code":0,"screenshots_found":33,"videos_found":1},"status":"keep","description":"Added evidence picker content-type selector assertions for the default Document selection.","timestamp":1778827744777,"segment":3,"confidence":3.3636363636363638,"asi":{"hypothesis":"When the Documents evidence picker is selected, the content type selector should be visible and default to Document before a URL is linked; asserting this strengthens pre-submit classification coverage.","outcome":"Evidence assertions increased from 37 to 39 while all 13 E2E tests passed.","next_action_hint":"Next promising assertion: verify optional note text appears in the expanded timeline entry if Leaflet rendering is stable, or assert the content type dropdown can expose another valid file evidence option without changing the submitted classification."}}
{"run":42,"commit":"9273905","metric":42,"metrics":{"e2e_unpassed_tests":0,"e2e_failures":0,"missing_required_flows":0,"e2e_exit_code":0,"screenshots_found":33,"videos_found":1},"status":"keep","description":"Added content-type dropdown option assertions while preserving the default Document selection.","timestamp":1778827868372,"segment":3,"confidence":3.2,"asi":{"hypothesis":"The Documents evidence picker should expose other valid file-evidence content type options while preserving the default Document selection if the user dismisses the dropdown; asserting this strengthens classification UI coverage without altering the submitted evidence type.","outcome":"Evidence assertions increased from 39 to 42 while all 13 E2E tests passed.","next_action_hint":"Next promising assertion: verify optional note text appears in the expanded timeline entry if Leaflet rendering is stable, or add a narrow assertion that the invalid URL validation clears after adding a valid URL."}}
{"run":43,"commit":"9273905","metric":44,"metrics":{"e2e_unpassed_tests":0,"e2e_failures":0,"missing_required_flows":0,"e2e_exit_code":0,"screenshots_found":33,"videos_found":1},"status":"keep","description":"Added assertions that valid URL submission clears prior validation error and resets the URL input.","timestamp":1778827989908,"segment":3,"confidence":3.230769230769231,"asi":{"hypothesis":"After a malformed URL is rejected, adding a valid external evidence URL should clear the validation message and reset the input field, strengthening validation recovery coverage without changing product behavior.","outcome":"Evidence assertions increased from 42 to 44 while all 13 E2E tests passed.","next_action_hint":"Next promising assertion: verify optional note text appears in the expanded timeline entry if Leaflet rendering is stable, or add a small assertion around the evidence picker empty selected-link message after removing the URL."}}
{"run":44,"commit":"9273905","metric":45,"metrics":{"e2e_unpassed_tests":0,"e2e_failures":0,"missing_required_flows":0,"e2e_exit_code":0,"screenshots_found":33,"videos_found":1},"status":"keep","description":"Added assertion that removing the selected external link restores the picker empty-state message.","timestamp":1778828119082,"segment":3,"confidence":3.185185185185185,"asi":{"hypothesis":"After removing the only selected external link, the evidence picker should return to its explicit empty selected-evidence state, not only disable submission; asserting the empty-state message strengthens picker state transition coverage.","outcome":"Evidence assertions increased from 44 to 45 while all 13 E2E tests passed.","next_action_hint":"Next promising assertion: verify optional note text appears in the expanded timeline entry if Leaflet rendering is stable, or add a stable post-submit assertion that the remove-evidence confirmation title names the Document evidence item."}}
{"run":45,"commit":"9273905","metric":46,"metrics":{"e2e_unpassed_tests":0,"e2e_failures":0,"missing_required_flows":0,"e2e_exit_code":0,"screenshots_found":33,"videos_found":1},"status":"keep","description":"Added remove-evidence confirmation title assertion to verify the dialog names the Document evidence item.","timestamp":1778828238424,"segment":3,"confidence":3.142857142857143,"asi":{"hypothesis":"The remove-evidence confirmation should identify the specific evidence item being removed, so asserting that the confirmation text includes the Document item title strengthens the owner-control flow without deleting evidence.","outcome":"Evidence assertions increased from 45 to 46 while all 13 E2E tests passed.","next_action_hint":"Next promising assertion: verify optional note text appears in the expanded timeline entry if Leaflet rendering is stable, or add a scoped assertion that the evidence item remains in the Document-filtered list after canceling removal."}}
{"run":46,"commit":"9273905","metric":48,"metrics":{"e2e_unpassed_tests":0,"e2e_failures":0,"missing_required_flows":0,"e2e_exit_code":0,"screenshots_found":33,"videos_found":1},"status":"keep","description":"Added post-cancel assertions that the Document filter remains active and remove-evidence control remains available.","timestamp":1778828363304,"segment":3,"confidence":3.066666666666667,"asi":{"hypothesis":"Canceling the remove-evidence confirmation should leave the user in the same Document-filtered timeline state with the owner remove control still available, strengthening the non-destructive cancel path.","outcome":"Evidence assertions increased from 46 to 48 while all 13 E2E tests passed.","next_action_hint":"Next promising assertion: verify optional note text appears in the expanded timeline entry if Leaflet rendering is stable, or add a stable screenshot checkpoint after the remove confirmation opens before canceling."}}
{"run":47,"commit":"pending","metric":0,"metrics":{"e2e_unpassed_tests":1,"e2e_failures":1,"missing_required_flows":0,"e2e_exit_code":1,"screenshots_found":33,"videos_found":1},"status":"discard","description":"Tried asserting the optional note text in the expanded evidence timeline entry, but the note text was not rendered in the final row.","timestamp":1778828492959,"segment":3,"confidence":3.066666666666667,"asi":{"hypothesis":"The optional note filled before linking evidence should appear in the expanded timeline entry, providing stronger end-to-end evidence metadata coverage.","outcome":"The full suite failed because the scoped timeline entry did not contain the optional note text 'published restoration work'. The note input may not have been visible/filled, or Leaflet note rendering is not stable in this flow.","rollback_reason":"Full E2E suite did not pass and primary evidence_assertions was zeroed by the harness.","next_action_hint":"Avoid optional note assertions unless first confirming the editor is filled and persisted. Prefer stable assertions around existing rendered timeline controls or add a targeted assertion before submission that the optional note editor is visible if needed."}}
