{"run":48,"commit":"9273905","metric":50,"metrics":{"e2e_unpassed_tests":0,"e2e_failures":0,"missing_required_flows":0,"e2e_exit_code":0,"screenshots_found":33,"videos_found":1},"status":"keep","description":"Added linked-file safety attribute assertions for target and noopener rel.","timestamp":1778828611333,"segment":3,"confidence":3.2,"asi":{"hypothesis":"The external evidence link should preserve safe outbound-link behavior by opening in a new tab with noopener protection; asserting these attributes strengthens final linked-evidence verification without depending on external services.","outcome":"Evidence assertions increased from 48 to 50 while all 13 E2E tests passed.","next_action_hint":"Next promising assertion: verify the external link is still visible and safe after returning to All filter, or assert the timeline article remains expanded after filter changes using aria-expanded."}}
{"run":49,"commit":"9273905","metric":52,"metrics":{"e2e_unpassed_tests":0,"e2e_failures":0,"missing_required_flows":0,"e2e_exit_code":0,"screenshots_found":33,"videos_found":1},"status":"keep","description":"Added noreferrer safety assertion and verified the evidence row remains expanded after returning to the All filter.","timestamp":1778828740274,"segment":3,"confidence":3.4482758620689653,"asi":{"hypothesis":"The external evidence link should include full safe outbound-link attributes, and returning to the All filter should preserve the expanded evidence row state while keeping the link visible.","outcome":"Evidence assertions increased from 50 to 52 while all 13 E2E tests passed.","next_action_hint":"Next promising assertion: add a stable pre-submit screenshot/assertion around selected-link row controls, or verify the evidence row still exposes the remove control after returning to All filter."}}
{"run":50,"commit":"9273905","metric":53,"metrics":{"e2e_unpassed_tests":0,"e2e_failures":0,"missing_required_flows":0,"e2e_exit_code":0,"screenshots_found":33,"videos_found":1},"status":"keep","description":"Added scoped assertion that the owner remove-evidence control remains visible in the evidence row after returning to All filter.","timestamp":1778828918302,"segment":3,"confidence":3.642857142857143,"asi":{"hypothesis":"After returning to the All timeline filter, the same expanded evidence row should still expose the owner remove-evidence control, strengthening row-level state coverage after filter changes.","outcome":"Evidence assertions increased from 52 to 53 while all 13 E2E tests passed.","next_action_hint":"Next promising assertion: add a stable pre-submit screenshot checkpoint around selected-link row controls, or assert the All-filter evidence row still contains the linked-file href within the scoped article."}}
{"run":51,"commit":"9273905","metric":55,"metrics":{"e2e_unpassed_tests":0,"e2e_failures":0,"missing_required_flows":0,"e2e_exit_code":0,"screenshots_found":33,"videos_found":1},"status":"keep","description":"Added filter state assertions that Document and Tree are inactive after returning to the All filter.","timestamp":1778829045997,"segment":3,"confidence":3.6551724137931036,"asi":{"hypothesis":"Selecting the All timeline filter should not only mark All active but also clear the previously selected Document filter and leave the non-matching Tree filter inactive; asserting the aria state strengthens filter accessibility coverage.","outcome":"Evidence assertions increased from 53 to 55 while all 13 E2E tests passed.","next_action_hint":"Next promising assertion: add scoped linked-file href assertion inside the final evidence article, or consider stopping because assertion density is high and further additions risk diminishing value."}}
